<?xml version="1.0" encoding="UTF-8"?>
<!DOCTYPE articulos [
    <!ELEMENT articulos (articulo)*>
    <!ELEMENT articulo ((codigo | id),nombre)>
    <!ELEMENT id (#PCDATA)>
    <!ELEMENT codigo (#PCDATA)>
    <!ELEMENT nombre (#PCDATA)>

]>
<articulos>
   <articulo>
   <codigo>JF-29</codigo>
      <nombre>Libreta</nombre>
   </articulo>
   <articulo>
      <id>1234</id>
      <nombre>Bol√≠grafo</nombre>
   </articulo>
</articulos>